{
  "id": "hursley-so21",
  "name": "Hursley",
  "village": "Hursley",
  "town": "Winchester",
  "county": "Hampshire",
  "postcode": "SO21",
  "hubCity": "Southampton",
  "regionDir": "North",
  "settlementType": "Non-City",
  "subRegion": "Winchester",
  "coords": {
    "lat": 51.06308,
    "lng": -1.29704
  },
  "coordsSource": "postcode-outward-approx",
  "houseTypeIds": [],
  "status": "researched",
  "overview": "Hursley is a Hampshire settlement in the SO21 area with longstanding parish and agricultural roots. It sits within a wider rural-commuter geography connected to nearby towns for day-to-day services. Current appeal is primarily village character, countryside access and practical road links across the county.",
  "character": "Rural Hampshire settlement character with mixed housing, parish identity and open countryside setting.",
  "amenities": [
    "Local parish/community facilities in Hursley or adjoining villages.",
    "Countryside footpaths, lanes and green-space recreation.",
    "Wider shopping, healthcare and rail options in nearby towns."
  ],
  "schools": [
    {
      "name": "Hursley area primary catchment school",
      "phase": "Primary",
      "type": "State",
      "ofsted": null,
      "distance": "~1-5 miles",
      "url": "https://www.hants.gov.uk/educationandlearning/findaschool"
    },
    {
      "name": "Winchester area secondary catchment school",
      "phase": "Secondary",
      "type": "State",
      "ofsted": null,
      "distance": "~4-10 miles",
      "url": "https://www.hants.gov.uk/educationandlearning/findaschool"
    }
  ],
  "transport": {
    "commutes": [
      {
        "to": "Winchester",
        "mode": "Drive",
        "typical": "~15-35 min",
        "notes": "Varies by exact address and route choice"
      },
      {
        "to": "Southampton",
        "mode": "Drive",
        "typical": "~30-60 min",
        "notes": "Typically via A-road/M27 corridor where relevant"
      }
    ]
  },
  "prices": {
    "summary": "SO21 housing values generally reflect constrained village supply and demand from households seeking rural settings with town access.",
    "asOf": "2026-05",
    "sourceUrl": "https://www.rightmove.co.uk/house-prices/SO21.html"
  },
  "thingsToDo": [
    "Explore local walking and cycling routes across surrounding countryside",
    "Use nearby market towns for events, dining and heritage attractions"
  ],
  "placesToEat": [
    "Country pubs and caf\u00e9s in nearby villages and market towns"
  ],
  "pros": [
    "Village/rural environment with community identity",
    "Good access to larger service centres by car"
  ],
  "cons": [
    "Less amenity density than urban locations",
    "Car dependency for many everyday journeys"
  ],
  "whoItSuits": "Well suited to buyers seeking Hampshire village living and countryside access, with realistic expectations around driving for schools, stations and larger shops.",
  "images": [],
  "sources": [
    {
      "label": "Wikipedia \u2014 Hursley",
      "url": "https://en.wikipedia.org/wiki/Hursley"
    },
    {
      "label": "Hampshire County Council \u2014 Find a school",
      "url": "https://www.hants.gov.uk/educationandlearning/findaschool"
    },
    {
      "label": "Rightmove House Prices SO21",
      "url": "https://www.rightmove.co.uk/house-prices/SO21.html"
    },
    {
      "label": "National Rail journey/station information",
      "url": "https://www.nationalrail.co.uk/"
    }
  ]
}
