{
  "id": "middle-wallop-so20",
  "name": "Middle Wallop",
  "village": "Middle Wallop",
  "town": "Andover",
  "county": "Hampshire",
  "postcode": "SO20",
  "hubCity": "Southampton",
  "regionDir": "North",
  "settlementType": "Non-City",
  "subRegion": "Andover",
  "coords": {
    "lat": 51.13144,
    "lng": -1.47436
  },
  "coordsSource": "postcode-outward-approx",
  "houseTypeIds": [],
  "status": "researched",
  "overview": "Middle Wallop is a small linear village in the Test Valley district, around six miles north-west of Stockbridge and seven miles south-west of Andover, sitting between Over Wallop and Nether Wallop along the Wallop Brook — a chalk-stream tributary of the River Test. The village is dominated by Middle Wallop Flying Station, home of the Army Air Corps and the Army Aviation Centre, with the active airfield running north-east of the A343. The Army Flying Museum (SO20 8DY), on the airfield perimeter, opened in 1974 and now holds over 35 fixed-wing and rotary aircraft including a recently-installed Apache AH Mk1 — the only example in any European museum. Visitor numbers run to tens of thousands annually. Middle Wallop was designated a Conservation Area in 2008; the village itself is small, with timber-framed cottages, farmhouses and a handful of mid-20th-century infill. The George Inn is the village pub, and the Wallops Parish Hall and a petrol station are nearby. The village's first recorded historical association is as the supposed site of a 5th-century battle between Vitalinus (possibly Vortigern) and Ambrosius Aurelianus.",
  "character": "Linear village along the A343, defined by the proximity of the active AAC airfield and its operational helicopter traffic. Building stock mixes 16th–19th-century cottages, RAF/AAC-era utilitarian buildings and modern infill. Conservation Area status applies.",
  "amenities": [
    "The George Inn (village pub)",
    "Petrol station (A343)",
    "Wallops Parish Hall",
    "Army Flying Museum (Apache Café open daily)",
    "Direct view of AAC Middle Wallop active airfield",
    "Veterinary surgery (shared Wallops)",
    "Shop with Post Office (in Nether Wallop)"
  ],
  "schools": [
    {
      "name": "Wallop Primary School (Nether Wallop)",
      "phase": "Primary",
      "ofsted": "Good",
      "distance": "1.0 mi",
      "url": "https://files.ofsted.gov.uk/v1/file/50221039"
    },
    {
      "name": "The Wallops' Pre-School",
      "phase": "Pre-school",
      "ofsted": null,
      "distance": "1.0 mi",
      "url": "https://www.thewallopspreschool.co.uk/"
    },
    {
      "name": "Test Valley School / Danebury School, Stockbridge",
      "phase": "Secondary",
      "ofsted": "Inadequate (2022)",
      "distance": "6.0 mi",
      "url": "https://reports.ofsted.gov.uk/"
    }
  ],
  "transport": {
    "commutes": [
      {
        "to": "London Waterloo (via Grateley)",
        "time": "~1h 20m",
        "mode": "drive + train (SWR West of England line)",
        "source": "https://www.nationalrail.co.uk/"
      },
      {
        "to": "London Waterloo (via Andover, fastest)",
        "time": "1h 2m",
        "mode": "drive + train",
        "source": "https://www.thetrainline.com/train-times/andover-to-london-waterloo"
      },
      {
        "to": "Salisbury",
        "time": "~25m",
        "mode": "drive (A343 / A30)",
        "source": "https://www.nationalrail.co.uk/"
      }
    ],
    "nearestStation": "Grateley (4.5 mi)",
    "roads": "A343 (through village); A303 ~3 mi; A30 (Stockbridge) ~6 mi"
  },
  "prices": {
    "avgSold12Mo": null,
    "avgDetached": null,
    "avgSemi": null,
    "avgTerraced": null,
    "avgFlat": null,
    "source": "https://www.rightmove.co.uk/house-prices/so20.html",
    "asOf": "2026-05"
  },
  "thingsToDo": [
    "Army Flying Museum (over 35 historic aircraft including Apache)",
    "Apache Café airfield-side dining (museum admission not required)",
    "Wallop Brook Way 4.7-mile walking route",
    "Historic Army Aircraft Flight displays at airshow events",
    "Walking from Middle Wallop into Nether Wallop St Andrew's church (Grade I)",
    "Quarley High Linear earthworks (~3 mi)"
  ],
  "placesToEat": [
    {
      "name": "The George Inn",
      "type": "Village pub",
      "notes": "Traditional pub on the A343",
      "url": "https://www.useyourlocal.com/"
    },
    {
      "name": "Apache Café, Army Flying Museum",
      "type": "Café",
      "notes": "Airfield-side dining open daily, no museum admission required",
      "url": "https://armyflying.com/"
    }
  ],
  "pros": [
    "Wallop Primary (Good, Ofsted May 2023) within a mile",
    "Notable visitor attraction (Army Flying Museum) within the village",
    "Wallop Brook chalk-stream walking route on the doorstep",
    "Stockbridge, Salisbury and Andover all within 25 minutes by road"
  ],
  "cons": [
    "Operational helicopter activity from AAC airfield generates noise",
    "A343 through-traffic, including military convoys at times",
    "No mainline station within the village (Grateley 4.5 mi, Andover 7 mi)",
    "Secondary catchment school rated Inadequate in 2022"
  ],
  "whoItSuits": "Buyers comfortable with military aviation noise (AAC helicopters are a daily presence) in exchange for a Good village primary, museum-and-café amenity within the village, and a position equidistant between Andover, Stockbridge and Salisbury. Service families on Middle Wallop posting will find this the obvious choice; civilians attracted by chalk-stream walks and modest prices relative to Stockbridge proper will too. Less suited to those wanting absolute rural quiet or to families needing the catchment secondary school.",
  "councilTaxBand": "D",
  "nearestStation": "Grateley (4.5 mi)",
  "primarySupermarket": "Waitrose, Stockbridge (6.0 mi); Sainsbury's, Andover (7.0 mi)",
  "images": [],
  "sources": [
    "https://en.wikipedia.org/wiki/Middle_Wallop",
    "https://en.wikipedia.org/wiki/Army_Flying_Museum",
    "https://armyflying.com/",
    "https://armyflying.com/about-us/",
    "https://files.ofsted.gov.uk/v1/file/50221039",
    "https://www.wallop.hants.sch.uk/",
    "https://www.thetrainline.com/train-times/andover-to-london-waterloo",
    "https://www.testvalley.gov.uk/benefitsandcounciltax/counciltax/council-tax-charges"
  ]
}
