{
  "id": "froxfield-green-gu32",
  "name": "Froxfield Green",
  "village": "",
  "town": "Petersfield",
  "county": "Hampshire",
  "postcode": "GU32",
  "hubCity": "",
  "regionDir": "",
  "settlementType": "",
  "subRegion": "",
  "coords": {
    "lat": 51.0344,
    "lng": -0.9763
  },
  "coordsSource": "os-opendata:place-centre",
  "houseTypeIds": [],
  "status": "researched",
  "overview": "A village in the civil parish of Froxfield and Privett, East Hampshire district. Froxfield Green (formerly just 'Froxfield' on Ordnance Survey maps until around 1960) sits on the high clay plateau north-west of Petersfield, about three miles from the market town and just north of the A272. The wider parish — which also contains High Cross, Privett and Bailey Green — had a population of 929 at the 2021 census. Around 825 feet above sea level, this is some of the highest ground in East Hampshire, with earthworks running north–south along the western edge of the village that may be Anglo-Saxon defensive works or a tribal boundary. Roman and Romano-British remains have been found south-east of the village. The original parish church at Froxfield Green was demolished in 1861; three of its Norman arches were reconstructed at the new St Peter's at High Cross. The 1921 village war memorial remains the most prominent landmark at the centre of the village.",
  "character": "Open-plateau settlement with widely spaced farmhouses and cottages, set among arable fields and the hangers to the east. Mostly working farms, period dwellings and converted outbuildings; a few newer infill houses. Inside the South Downs National Park, with strict landscape protection.",
  "amenities": [
    "Froxfield Green war memorial (1921)",
    "(at High Cross ~1 mi:) Froxfield CofE Primary and Pre-School",
    "King George V Memorial Village Hall (Froxfield)",
    "St Peter's Church, High Cross (1862, includes Norman arches from the demolished Froxfield Green church)",
    "The Trooper Inn (High Cross, ~1.5 mi)",
    "Footpath network across the parish and onto the Hangers Way"
  ],
  "schools": [
    {
      "name": "Froxfield Church of England Primary and Pre-School",
      "phase": "Primary (2–11)",
      "ofsted": "Good (March 2024)",
      "distance": "1.0 mi",
      "url": "https://reports.ofsted.gov.uk/provider/21/116289"
    },
    {
      "name": "The Petersfield School",
      "phase": "Secondary",
      "ofsted": "Good",
      "distance": "3.5 mi",
      "url": "https://www.tps.hants.sch.uk/"
    },
    {
      "name": "Churcher's College",
      "phase": "Independent (3–18)",
      "ofsted": null,
      "distance": "3.5 mi",
      "url": "https://www.churcherscollege.com/"
    }
  ],
  "transport": {
    "nearestStation": "Petersfield (3.0 mi)",
    "commutes": [
      {
        "to": "London Waterloo",
        "time": "1h 2m – 1h 17m direct",
        "mode": "drive to Petersfield + direct South Western Railway",
        "source": "https://www.southwesternrailway.com/train-times/petersfield-to-london-waterloo"
      },
      {
        "to": "Portsmouth Harbour",
        "time": "~30m",
        "mode": "Petersfield + direct South Western Railway",
        "source": "https://www.southwesternrailway.com/travelling-with-us/at-the-station/petersfield"
      }
    ],
    "roads": "A272 (Winchester–Midhurst) at the southern edge of the parish; A3 ~4 mi east at Petersfield"
  },
  "prices": {
    "avgSold12Mo": null,
    "avgDetached": null,
    "avgSemi": null,
    "avgTerraced": null,
    "avgFlat": null,
    "source": "https://www.rightmove.co.uk/house-prices/gu32.html",
    "asOf": "2026-05"
  },
  "thingsToDo": [
    "Hangers Way walking",
    "Ashford Hangers National Nature Reserve",
    "Shoulder of Mutton Hill (Edward Thomas memorial)",
    "Selborne and Gilbert White's House (~4 mi)",
    "Privett Holy Trinity church (Grade II* listed, Churches Conservation Trust)"
  ],
  "placesToEat": [
    {
      "name": "The Trooper Inn",
      "type": "Pub with rooms and restaurant",
      "notes": "17th-century inn at High Cross with eight rooms and open-fire bar",
      "url": "https://www.trooperinn.com/"
    },
    {
      "name": "The Pub With No Name (White Horse)",
      "type": "Country pub with rooms",
      "notes": "Unsigned 17th-century pub at Priors Dean, ~2.5 mi north-west",
      "url": "https://www.thepubwithnoname.uk/"
    }
  ],
  "pros": [
    "Catchment Froxfield CofE Primary rated Good (March 2024) is just down the lane",
    "Inside the South Downs National Park with deep landscape protection",
    "Petersfield station within ~3 miles for direct London Waterloo trains",
    "Genuine downland feel at over 800 feet above sea level — long views in every direction",
    "Two heritage-quality pubs within easy walk or short drive (Trooper, Pub With No Name)"
  ],
  "cons": [
    "No shop, no pub, no active church within Froxfield Green itself — village amenities are at High Cross (~1 mi)",
    "High elevation and clay plateau location — wind and winter cold are real factors",
    "Stock is dominated by larger farmhouse and detached country properties; very limited starter / smaller-cottage supply",
    "SDNP and parish settlement boundary tightly limit new build and extensions",
    "Rural broadband varies sharply by postcode; some lanes still on slow ADSL"
  ],
  "whoItSuits": "Buyers wanting a higher-elevation downland setting with the school, hall and pub at High Cross within walking range, and the Petersfield mainline within a short drive. Strong fit for families targeting Froxfield CofE Primary and the Petersfield/Churcher's secondary route, and for country buyers attracted to the South Downs landscape. Less suited to first-time buyers — stock here is typically larger period or detached property, and the entry pricing reflects that.",
  "nearestStation": "Petersfield (3.0 mi)",
  "primarySupermarket": "Waitrose Petersfield, Lavant Street (~3.5 mi); Tesco Petersfield, Bedford Road (~4 mi)",
  "images": [],
  "sources": [
    {
      "label": "Wikipedia — Froxfield Green",
      "url": "https://en.wikipedia.org/wiki/Froxfield_Green"
    },
    {
      "label": "Wikipedia — Froxfield and Privett parish",
      "url": "https://en.wikipedia.org/wiki/Froxfield_and_Privett"
    },
    {
      "label": "Froxfield Village Hall and Village Information",
      "url": "https://www.froxfieldvillagehall.co.uk/village-information"
    },
    {
      "label": "Ofsted — Froxfield CofE Primary and Pre-School",
      "url": "https://reports.ofsted.gov.uk/provider/21/116289"
    },
    {
      "label": "The Trooper Inn",
      "url": "https://www.trooperinn.com/"
    },
    {
      "label": "South Western Railway — Petersfield to London Waterloo",
      "url": "https://www.southwesternrailway.com/train-times/petersfield-to-london-waterloo"
    },
    {
      "label": "East Hants DC — Council Tax 2026/27 (Froxfield & Privett parish)",
      "url": "https://www.easthants.gov.uk/sites/default/files/2026-03/Council%20tax%20per%20valuation%20band%202026-27.pdf"
    }
  ],
  "rightmove": {
    "locationIdentifier": "POSTCODE^1666382",
    "identifierType": "POSTCODE",
    "identifierQuality": "tight",
    "resolvedAt": "2026-05-31T20:14:43.654Z"
  },
  "geofenceRadiusMi": 3,
  "searchRadiusMi": 3,
  "active": true
}
